{
  "schemaVersion": "1.0",
  "id": "cursor",
  "displayName": "Cursor",
  "status": "supported",
  "instructionDiscovery": "rules",
  "skillDiscovery": "agent-skills",
  "bindingTarget": ".cursor/rules/forgerail.mdc",
  "detectionTargets": [
    ".cursor"
  ],
  "bindingModes": [
    "thin-reference"
  ],
  "bindingTemplates": {
    "thin-reference": "bindings/cursor-thin.mdc"
  },
  "unmanagedBindingPolicy": "reject",
  "managedMarker": "forgerail:binding:cursor:v1",
  "activationBoundary": "new-task-required",
  "verification": {
    "mode": "new-task-discovery",
    "expectedSkills": [
      "forgerail"
    ]
  },
  "limitations": [
    "On 2026-10-30 the user completed three fresh isolated Cursor IDE sessions against exact shared Core SHA-256 003e26034a9cb7d0650f7ace6a5ff48f65ddaa6f0546b419f003c04bdb29faa8. Bounded acceptance combines Agent-authored reports and retained command outputs with independently rechecked candidate/Core identity, protected files, Git state and functional checks. Two engineering sessions fixed a programmatic page entry and a library contract; the read-only continuation distinguished historical evidence from the current candidate and respected changed scope. Reports describe project Core reads and no active global Skill search, browser use or external writes; complete independent tool transcripts were not supplied. Cursor version and tier are unknown; Grok 4.7 is reported self-description. Programmatic DOM checks are not real-browser or human acceptance. One report mentions a host browser rule; its exact priority was not independently audited, so precedence compliance is not certified. Acceptance retains only shared AGENTS.md plus exact project-local Core; Rule fallback, CLI, Cloud and other-host support are not upgraded. A changed Core requires fresh acceptance.",
    "Historical 0.1.11 acceptance: On 2026-10-26 the user reported completing two fresh isolated Cursor IDE sessions against exact shared Core SHA-256 7ad344f3eb2b77f3d4b25d98bbbd0142150540108d2f8153c8f500f36aa6bb7d. Bounded acceptance combines Agent-authored reports with independently matched preparation anchors, immutable candidate/Core, current Git/file/test checks and retained passing before/after branch observations. The engineering report describes loading Core, optional-delegation and the declared Profile/policy, then directly handling a small task within the external-worker prohibition. The read-only report describes README-only task activity; final product files/refs are unchanged. No complete original transcript was supplied, so the full read sequence, extra questions and absence of unrecorded actions are not independently audited. Cursor version, model and tier are unknown; Grok 4.7 is only the report's system self-description. Explicit condition probes are reasoning evidence, not executor runtime or recovery tests. Acceptance retains the existing shared AGENTS.md plus exact project-local Core route only; Rule fallback remains profile-only, and CLI/Cloud/other-host support is not upgraded. A changed Core requires fresh acceptance.",
    "Historical 0.1.10 acceptance: On 2026-10-22 the user exercised two fresh isolated Cursor IDE Agent sessions against the exact shared Core tree SHA-256 3c75fcfd8f11317e0b2ff40878ef86d87d12b4be61b2df4654328f96de7a5a9a; bounded evidence was independently reviewed on 2026-10-23. Original transcripts retain tool-call inputs but no tool-result bodies: the engineering session requested the Skill, Project Profile and declared policy, invoked before/create/after branch operations, changed only format.mjs and its test, and reported validation and impact; the read-only transcript has a single README Read. The original before observation passed; independent current after comparison, immutable-input/file/Git checks and tests passed. Cursor version and original model are unknown. The missing original after/test outputs remain unverified as historical results. Acceptance covers only AGENTS.md plus this exact project-local Core route, not every guidance clause or task. A changed Core requires new IDE acceptance.",
    "Historical acceptance only: Cursor IDE 3.25.6 with Claude Opus 5.5 High was exercised by the user on 2026-10-20 in separate fresh disposable read-only and bounded engineering sessions using AGENTS.md and the exact .agents/skills/forgerail Core tree (SHA-256 bc188e56d4753a295b90e1e6ad422366a1b41aa83fef3999bac0340ec2c539b5). Acceptance combines user-provided UI screenshots and an Agent-authored session report with a retained branch-before observation and independently rechecked Git/file/test results. The report describes loading the Project Profile and declared source; the full file-read sequence is not independently audited. The read-only screenshot shows README-only exploration and the workspace remained unchanged. A changed Core tree needs new IDE acceptance. The Cursor Rule plus Skill path was independently smoke-tested only in Cursor CLI 2026.09.18 and remains profile-only in the IDE.",
    "Each adopted project still needs fresh-session verification of its own binding, Skill identity, and behavior; CLI and Cloud Agent behavior are not certified by the IDE result.",
    "A Cursor Rule can duplicate an existing AGENTS.md Core pointer; review the adoption plan and keep one Core owner."
  ]
}
