{
  "schemaVersion": "1.0",
  "id": "cursor",
  "displayName": "Cursor",
  "status": "profile-only",
  "instructionDiscovery": "rules",
  "skillDiscovery": "unknown",
  "bindingTarget": ".cursor/rules/forgerail.mdc",
  "detectionTargets": [".cursor"],
  "bindingModes": ["thin-reference"],
  "bindingTemplates": {
    "thin-reference": "bindings/cursor-thin.mdc"
  },
  "unmanagedBindingPolicy": "reject",
  "managedMarker": "forgerail:binding:cursor:v1",
  "activationBoundary": "host-specific-verification-required",
  "verification": { "mode": "profile-only", "expectedSkills": [] },
  "limitations": ["End-to-end activation has not been verified for alpha.1."]
}
