{
  "schemaVersion": "1.0",
  "id": "claude-code",
  "displayName": "Claude Code",
  "status": "profile-only",
  "instructionDiscovery": "task-start",
  "skillDiscovery": "agent-skills",
  "bindingTarget": "CLAUDE.md",
  "detectionTargets": ["CLAUDE.md", ".claude"],
  "bindingModes": ["thin-reference"],
  "bindingTemplates": {
    "thin-reference": "bindings/claude-code-thin.md"
  },
  "unmanagedBindingPolicy": "append-managed-block",
  "managedMarker": "forgerail:binding:claude-code:v1",
  "activationBoundary": "host-specific-verification-required",
  "verification": { "mode": "profile-only", "expectedSkills": [] },
  "limitations": ["End-to-end activation has not been verified for alpha.1."]
}
