{
  "schemaVersion": "1.0",
  "id": "codex",
  "displayName": "Codex",
  "status": "supported",
  "instructionDiscovery": "task-start",
  "skillDiscovery": "agent-plugin-skills",
  "bindingTarget": "AGENTS.md",
  "detectionTargets": ["AGENTS.md"],
  "bindingModes": ["managed-block", "thin-reference"],
  "bindingTemplates": {
    "managed-block": "bindings/codex-compact.md",
    "thin-reference": "bindings/codex-thin.md"
  },
  "unmanagedBindingPolicy": "append-managed-block",
  "managedMarker": "forgerail:binding:codex:v1",
  "activationBoundary": "new-task-required",
  "verification": {
    "mode": "new-task-discovery",
    "expectedSkills": ["architecture-convergence-audit", "forgerail", "forgerail-workspace-diagnosis", "workspace-health-review"]
  },
  "limitations": ["A new task is required after adoption."]
}
